{
  "schema_version": "agent-loop.project-profile.v1",
  "id": "squad",
  "version": 1,
  "repository": "TomasBack2Future/voice-agent-squad",
  "context_by_phase": {
    "implementation": ["AGENTS.md", "docs/contributing.md", "docs/architecture.md", "docs/README.md", "the owning command or coordination contract"],
    "review": ["the canonical Issue and acceptance mapping", "docs/environments-and-ci.md", "the current repository review policy"],
    "staging": [],
    "production": []
  },
  "gates": {
    "fast": ["go vet ./...", "CGO_ENABLED=1 go test -race ./...", "CGO_ENABLED=0 go build ./...", "golangci-lint run when available", "git diff --check"],
    "review": ["review the complete base...head diff and satisfy the repository's current PR policy"],
    "staging": []
  },
  "resources": {},
  "risk_probes": ["For claim, reservation or migration changes, test atomicity, fencing, idempotency and negative paths with isolated state."]
}
