{
  "schema_version": "agent-loop.project-profile.v1",
  "id": "studio",
  "version": 1,
  "repository": "TomasBack2Future/voice-agent-studio",
  "release_skill": {
    "name": "studio-deploy-production",
    "path": ".agents/skills/studio-deploy-production/SKILL.md"
  },
  "context_by_phase": {
    "implementation": [
      "AGENTS.md",
      "CONTRIBUTING.md",
      "docs/README.md",
      "the owning component or contract document selected by touched paths"
    ],
    "review": [
      ".github/PULL_REQUEST_TEMPLATE.md",
      "the frozen Issue contract and AC-to-evidence mapping",
      "the current repository review policy"
    ],
    "staging": [
      "docs/deployment.md",
      "docs/environments-and-ci.md",
      "docs/release-acceptance.md",
      "references/couchbase-environments.md before any direct database access or deployment configuration change",
      "the component-specific staging capability reference",
      "references/actions-sls-fallback.md only for an existing synthetic logging run when direct SLS credentials are unavailable"
    ],
    "production": [
      "docs/deployment.md",
      "the separately authorized production capability reference",
      "references/couchbase-environments.md before direct database access or deployment configuration change; verify production cluster, bucket, scope and runtime identity from the live accepted cutover receipt"
    ]
  },
  "gates": {
    "fast": [
      "format and diff checks for touched components",
      "compile or typecheck touched components",
      "targeted regression tests",
      "CI classifier validation"
    ],
    "review": [
      "Start at the first complete stable diff after fast gates and self-review, independently of merge hold, full CI completion and ENV waits; record readiness and start times",
      "one PR-wide managed review using the explicitly selected repository-permitted backend (grok, claude, codex or muse), admitted only for the final complete frozen diff; a required App-pinned Check remains authoritative",
      "one in-flight review per PR with a freeze write barrier and deterministic join",
      "full deterministic CI joined with the review result"
    ],
    "staging": [
      "read-only prerequisite receipt before environment ownership; for report intake use node scripts/report_intake_preflight.mjs with the explicit target and exact CI tuple when that repository capability is available",
      "explicit kubeconfig and context selection",
      "explicit Studio Couchbase environment and credential role; clear inherited CB_* values before loading the selected environment, and verify connected cluster, bucket and scope",
      "current PR tuple and required checks revalidated before and after ownership",
      "exact-revision rollout, functional acceptance, bounded SLS evidence and rollback disposition"
    ]
  },
  "resources": {
    "staging": "ENV-001",
    "production": "ENV-002",
    "cluster_selection": "explicit kubeconfig and context; never a shell nickname",
    "production_default": "forbidden unless the assignment explicitly sets production=true",
    "studio_scope": "studio",
    "policy": "workspace/resources/studio.json",
    "importer": {
      "staging": "ENV-003",
      "production": "ENV-004"
    },
    "feedback": {
      "staging": "ENV-005",
      "production": "ENV-006"
    },
    "scope_activation": "Use narrow scopes only after the selected ledger policy and runtime are installed; old calls retain legacy coverage.",
    "acquisition_order": "lexicographic item ID; no in-place scope upgrades"
  },
  "risk_probes": [
    "For new deployed components, exercise first publication without a prior image, unchanged-source revision stamping, and rollback tool-cache miss; check image, Secret and storage prerequisites before the environment lock.",
    "For at-most-once publication, exercise a lost success response followed by bounded reconciliation.",
    "For paginated reconciliation, prove a full page budget is inconclusive rather than proof of absence.",
    "For retry or requeue changes, preserve monotonic evidence that a side effect may already have occurred.",
    "For schema upgrades, open a prior-version database and verify the migrated invariant.",
    "For auth, credentials or privacy changes, test deny-by-default and negative data-flow paths."
  ]
}
